{
  "presence": "running_instance",
  "rung": "reuse_binary",
  "provisioned": true,
  "lockedVersion": "v1.19.28",
  "instance": {
    "owner": "a2",
    "controller": "127.0.0.1:9097",
    "secretConfigured": true,
    "version": "v1.19.29",
    "capabilities": ["rest_api", "meta_core", "configs_read"],
    "configFile": "/Users/alice/.a2/mihomo/config.yaml"
  },
  "foreignBinary": {
    "path": "/opt/homebrew/bin/mihomo",
    "version": "v1.19.29"
  },
  "managed": {
    "label": "com.a2.mihomo",
    "supervisor": "launchd",
    "unitPath": "/Users/alice/Library/LaunchAgents/com.a2.mihomo.plist",
    "unitInstalled": true,
    "state": "running",
    "pid": 51234,
    "binaryKind": "reused",
    "binaryPath": "/Users/alice/.a2/mihomo/bin/mihomo",
    "binaryTarget": "/opt/homebrew/bin/mihomo",
    "version": "v1.19.29",
    "configPath": "/Users/alice/.a2/mihomo/config.yaml",
    "dataDir": "/Users/alice/.a2/mihomo",
    "controller": "127.0.0.1:9097"
  },
  "compatibility": {
    "floor": "1.19.0",
    "meets": true,
    "version": "v1.19.29",
    "shortfalls": []
  },
  "home": "/Users/alice/.a2"
}
