{
  "presence": "binary_only",
  "rung": "managed_install",
  "provisioned": false,
  "lockedVersion": "v1.19.28",
  "foreignBinary": {
    "path": "/usr/local/bin/mihomo",
    "version": "v1.14.2"
  },
  "managed": {
    "label": "com.a2.mihomo",
    "supervisor": "systemd",
    "unitPath": "/home/alice/.config/systemd/user/com.a2.mihomo.service",
    "unitInstalled": false,
    "state": "not_installed",
    "binaryKind": "absent",
    "binaryPath": "/home/alice/.a2/mihomo/bin/mihomo",
    "configPath": "/home/alice/.a2/mihomo/config.yaml",
    "dataDir": "/home/alice/.a2/mihomo",
    "controller": "127.0.0.1:9097"
  },
  "compatibility": {
    "floor": "1.19.0",
    "meets": true,
    "version": "v1.19.28",
    "shortfalls": []
  },
  "fallback": {
    "from": "reuse_binary",
    "shortfalls": ["version_below_floor"],
    "reason": "盘上那份 mihomo(/usr/local/bin/mihomo,版本 v1.14.2)不达兼容地板 1.19.0,已回退为按锁定版 v1.19.28 隔离安装 —— 内核不会去升级不属于它的二进制。"
  },
  "skippedController": "192.168.1.10:9090",
  "home": "/home/alice/.a2"
}
